{
  "schema_version": "1.0",
  "proposal_type": "policy_stages",
  "source_metadata": {
    "generator": "fixture",
    "note": "Representative of an external LLM's output shape (design-notes: tests/test_proposal.py). Additive: keeps S1/S2 verbatim so every existing REQ keeps resolving, adds S3."
  },
  "stages": [
    {
      "id": "S1",
      "name": "sample ファイル存在",
      "responsibility": "target/sample.txt が存在する",
      "depends_on": [],
      "verification_type": "file_exists",
      "required_contract_fields": ["target"]
    },
    {
      "id": "S2",
      "name": "キーワード包含",
      "responsibility": "target/sample.txt に \"hello\" が含まれる",
      "depends_on": ["S1"],
      "verification_type": "substring_match",
      "required_contract_fields": ["target", "must_contain"]
    },
    {
      "id": "S3",
      "name": "設定ファイル存在",
      "responsibility": "target/sample.txt が存在する (移行先サンプル段階)",
      "depends_on": [],
      "verification_type": "file_exists",
      "required_contract_fields": ["target"]
    }
  ]
}
